Sheet: Foglio1
A1: DATA | B1: Minuti fatti | C1: Lezioni fatte | D1: Minuti/Ore rimanenti | E1: Percorso | F1: Avanzamento | G1: Avanzamento sezione
E2: 1689
A3: MINUTI SALTATI | D3: of:=IF([.B3]<>"";([.$E$2]-SUM([.$B3:.$B$3])) & "/" & (ROUND(([.$E$2]-SUM([.$B3:.$B$3]))/60;1));"") ->  | E3: of:=[.E2]-[.B3] -> 1689 | F3: of:=IF([.B3]<>"";[.$E$2]-[.$B$3];"") -> 
A4: 2024-05-13 | B4: of:=4+3 -> 7 | C4: 2 | D4: of:=IF([.B4]<>"";([.$E$2]-SUM([.$B$3:.$B4])) & "/" & (ROUND(([.$E$2]-SUM([.$B$3:.$B4]))/60;1));"") -> 1682/28 | E4: of:=IF(OR([.E3]="" ;[.E3]=0);"";IF([.E3]-60>0;[.E3]-60;0)) -> 1629 | F4: of:=IF([.B4]<>"";[.E4]-([.$E$3]-SUM([.$B$3:.$B4]));"") -> -53 | G4: FINE SEZ.01
A5: 2024-05-13 | B5: of:=1+6+24 -> 31 | C5: 5 | D5: of:=IF([.B5]<>"";([.$E$2]-SUM([.$B$3:.$B5])) & "/" & (ROUND(([.$E$2]-SUM([.$B$3:.$B5]))/60;1));"") -> 1651/27,5 | E5: 1629 | F5: of:=IF([.B5]<>"";[.E5]-([.$E$2]-SUM([.$B$3:.$B5]));"") -> -22
A6: 2024-05-14 | D6: of:=IF([.B6]<>"";([.$E$2]-SUM([.$B$3:.$B6])) & "/" & (ROUND(([.$E$2]-SUM([.$B$3:.$B6]))/60;1));"") ->  | E6: of:=IF(OR([.E5]="" ;[.E5]=0);"";IF([.E5]-60>0;[.E5]-60;0)) -> 1569 | F6: of:=IF([.B6]<>"";[.E6]-([.$E$2]-SUM([.$B$3:.$B6]));"") -> 
A7: 2024-05-15 | D7: of:=IF([.B7]<>"";([.$E$2]-SUM([.$B$3:.$B7])) & "/" & (ROUND(([.$E$2]-SUM([.$B$3:.$B7]))/60;1));"") ->  | E7: of:=IF(OR([.E6]="" ;[.E6]=0);"";IF([.E6]-60>0;[.E6]-60;0)) -> 1509 | F7: of:=IF([.B7]<>"";[.E7]-([.$E$2]-SUM([.$B$3:.$B7]));"") -> 
A8: 2024-05-16 | D8: of:=IF([.B8]<>"";([.$E$2]-SUM([.$B$3:.$B8])) & "/" & (ROUND(([.$E$2]-SUM([.$B$3:.$B8]))/60;1));"") ->  | E8: of:=IF(OR([.E7]="" ;[.E7]=0);"";IF([.E7]-60>0;[.E7]-60;0)) -> 1449 | F8: of:=IF([.B8]<>"";[.E8]-([.$E$2]-SUM([.$B$3:.$B8]));"") -> 
A9: 2024-05-17 | D9: of:=IF([.B9]<>"";([.$E$2]-SUM([.$B$3:.$B9])) & "/" & (ROUND(([.$E$2]-SUM([.$B$3:.$B9]))/60;1));"") ->  | E9: of:=IF(OR([.E8]="" ;[.E8]=0);"";IF([.E8]-60>0;[.E8]-60;0)) -> 1389 | F9: of:=IF([.B9]<>"";[.E9]-([.$E$2]-SUM([.$B$3:.$B9]));"") -> 
A10: 2024-05-18 | D10: of:=IF([.B10]<>"";([.$E$2]-SUM([.$B$3:.$B10])) & "/" & (ROUND(([.$E$2]-SUM([.$B$3:.$B10]))/60;1));"") ->  | E10: of:=IF(OR([.E9]="" ;[.E9]=0);"";IF([.E9]-60>0;[.E9]-60;0)) -> 1329 | F10: of:=IF([.B10]<>"";[.E10]-([.$E$2]-SUM([.$B$3:.$B10]));"") -> 
A11: 2024-05-19 | D11: of:=IF([.B11]<>"";([.$E$2]-SUM([.$B$3:.$B11])) & "/" & (ROUND(([.$E$2]-SUM([.$B$3:.$B11]))/60;1));"") ->  | E11: of:=IF(OR([.E10]="" ;[.E10]=0);"";IF([.E10]-60>0;[.E10]-60;0)) -> 1269 | F11: of:=IF([.B11]<>"";[.E11]-([.$E$2]-SUM([.$B$3:.$B11]));"") -> 
A12: 2024-05-20 | D12: of:=IF([.B12]<>"";([.$E$2]-SUM([.$B$3:.$B12])) & "/" & (ROUND(([.$E$2]-SUM([.$B$3:.$B12]))/60;1));"") ->  | E12: of:=IF(OR([.E11]="" ;[.E11]=0);"";IF([.E11]-60>0;[.E11]-60;0)) -> 1209 | F12: of:=IF([.B12]<>"";[.E12]-([.$E$2]-SUM([.$B$3:.$B12]));"") -> 
A13: 2024-05-21 | D13: of:=IF([.B13]<>"";([.$E$2]-SUM([.$B$3:.$B13])) & "/" & (ROUND(([.$E$2]-SUM([.$B$3:.$B13]))/60;1));"") ->  | E13: of:=IF(OR([.E12]="" ;[.E12]=0);"";IF([.E12]-60>0;[.E12]-60;0)) -> 1149 | F13: of:=IF([.B13]<>"";[.E13]-([.$E$2]-SUM([.$B$3:.$B13]));"") -> 
A14: 2024-05-22 | D14: of:=IF([.B14]<>"";([.$E$2]-SUM([.$B$3:.$B14])) & "/" & (ROUND(([.$E$2]-SUM([.$B$3:.$B14]))/60;1));"") ->  | E14: of:=IF(OR([.E13]="" ;[.E13]=0);"";IF([.E13]-60>0;[.E13]-60;0)) -> 1089 | F14: of:=IF([.B14]<>"";[.E14]-([.$E$2]-SUM([.$B$3:.$B14]));"") -> 
A15: 2024-05-23 | D15: of:=IF([.B15]<>"";([.$E$2]-SUM([.$B$3:.$B15])) & "/" & (ROUND(([.$E$2]-SUM([.$B$3:.$B15]))/60;1));"") ->  | E15: of:=IF(OR([.E14]="" ;[.E14]=0);"";IF([.E14]-60>0;[.E14]-60;0)) -> 1029 | F15: of:=IF([.B15]<>"";[.E15]-([.$E$2]-SUM([.$B$3:.$B15]));"") -> 
A16: 2024-05-24 | D16: of:=IF([.B16]<>"";([.$E$2]-SUM([.$B$3:.$B16])) & "/" & (ROUND(([.$E$2]-SUM([.$B$3:.$B16]))/60;1));"") ->  | E16: of:=IF(OR([.E15]="" ;[.E15]=0);"";IF([.E15]-60>0;[.E15]-60;0)) -> 969 | F16: of:=IF([.B16]<>"";[.E16]-([.$E$2]-SUM([.$B$3:.$B16]));"") -> 
A17: 2024-05-25 | D17: of:=IF([.B17]<>"";([.$E$2]-SUM([.$B$3:.$B17])) & "/" & (ROUND(([.$E$2]-SUM([.$B$3:.$B17]))/60;1));"") ->  | E17: of:=IF(OR([.E16]="" ;[.E16]=0);"";IF([.E16]-60>0;[.E16]-60;0)) -> 909 | F17: of:=IF([.B17]<>"";[.E17]-([.$E$2]-SUM([.$B$3:.$B17]));"") -> 
A18: 2024-05-26 | D18: of:=IF([.B18]<>"";([.$E$2]-SUM([.$B$3:.$B18])) & "/" & (ROUND(([.$E$2]-SUM([.$B$3:.$B18]))/60;1));"") ->  | E18: of:=IF(OR([.E17]="" ;[.E17]=0);"";IF([.E17]-60>0;[.E17]-60;0)) -> 849 | F18: of:=IF([.B18]<>"";[.E18]-([.$E$2]-SUM([.$B$3:.$B18]));"") -> 
A19: 2024-05-27 | D19: of:=IF([.B19]<>"";([.$E$2]-SUM([.$B$3:.$B19])) & "/" & (ROUND(([.$E$2]-SUM([.$B$3:.$B19]))/60;1));"") ->  | E19: of:=IF(OR([.E18]="" ;[.E18]=0);"";IF([.E18]-60>0;[.E18]-60;0)) -> 789 | F19: of:=IF([.B19]<>"";[.E19]-([.$E$2]-SUM([.$B$3:.$B19]));"") -> 
A20: 2024-05-28 | D20: of:=IF([.B20]<>"";([.$E$2]-SUM([.$B$3:.$B20])) & "/" & (ROUND(([.$E$2]-SUM([.$B$3:.$B20]))/60;1));"") ->  | E20: of:=IF(OR([.E19]="" ;[.E19]=0);"";IF([.E19]-60>0;[.E19]-60;0)) -> 729 | F20: of:=IF([.B20]<>"";[.E20]-([.$E$2]-SUM([.$B$3:.$B20]));"") -> 
A21: 2024-05-29 | D21: of:=IF([.B21]<>"";([.$E$2]-SUM([.$B$3:.$B21])) & "/" & (ROUND(([.$E$2]-SUM([.$B$3:.$B21]))/60;1));"") ->  | E21: of:=IF(OR([.E20]="" ;[.E20]=0);"";IF([.E20]-60>0;[.E20]-60;0)) -> 669 | F21: of:=IF([.B21]<>"";[.E21]-([.$E$2]-SUM([.$B$3:.$B21]));"") -> 
A22: 2024-05-30 | D22: of:=IF([.B22]<>"";([.$E$2]-SUM([.$B$3:.$B22])) & "/" & (ROUND(([.$E$2]-SUM([.$B$3:.$B22]))/60;1));"") ->  | E22: of:=IF(OR([.E21]="" ;[.E21]=0);"";IF([.E21]-60>0;[.E21]-60;0)) -> 609 | F22: of:=IF([.B22]<>"";[.E22]-([.$E$2]-SUM([.$B$3:.$B22]));"") ->  | G22: of:=IF([.B22]="";"";ROUND((368-SUM([.B$13:.$B23]))/60;1)) -> 
A23: 2024-05-31 | D23: of:=IF([.B23]<>"";([.$E$2]-SUM([.$B$3:.$B23])) & "/" & (ROUND(([.$E$2]-SUM([.$B$3:.$B23]))/60;1));"") ->  | E23: of:=IF(OR([.E22]="" ;[.E22]=0);"";IF([.E22]-60>0;[.E22]-60;0)) -> 549 | F23: of:=IF([.B23]<>"";[.E23]-([.$E$2]-SUM([.$B$3:.$B23]));"") ->  | G23: of:=IF([.B23]="";"";ROUND((368-SUM([.B$13:.$B24]))/60;1)) -> 
A24: 2024-06-01 | D24: of:=IF([.B24]<>"";([.$E$2]-SUM([.$B$3:.$B24])) & "/" & (ROUND(([.$E$2]-SUM([.$B$3:.$B24]))/60;1));"") ->  | E24: of:=IF(OR([.E23]="" ;[.E23]=0);"";IF([.E23]-60>0;[.E23]-60;0)) -> 489 | F24: of:=IF([.B24]<>"";[.E24]-([.$E$2]-SUM([.$B$3:.$B24]));"") ->  | G24: of:=IF([.B24]="";"";ROUND((368-SUM([.B$13:.$B25]))/60;1)) -> 
A25: 2024-06-02 | D25: of:=IF([.B25]<>"";([.$E$2]-SUM([.$B$3:.$B25])) & "/" & (ROUND(([.$E$2]-SUM([.$B$3:.$B25]))/60;1));"") ->  | E25: of:=IF(OR([.E24]="" ;[.E24]=0);"";IF([.E24]-60>0;[.E24]-60;0)) -> 429 | F25: of:=IF([.B25]<>"";[.E25]-([.$E$2]-SUM([.$B$3:.$B25]));"") ->  | G25: of:=IF([.B25]="";"";ROUND((368-SUM([.B$13:.$B26]))/60;1)) -> 
A26: 2024-06-03 | D26: of:=IF([.B26]<>"";([.$E$2]-SUM([.$B$3:.$B26])) & "/" & (ROUND(([.$E$2]-SUM([.$B$3:.$B26]))/60;1));"") ->  | E26: of:=IF(OR([.E25]="" ;[.E25]=0);"";IF([.E25]-60>0;[.E25]-60;0)) -> 369 | F26: of:=IF([.B26]<>"";[.E26]-([.$E$2]-SUM([.$B$3:.$B26]));"") ->  | G26: of:=IF([.B26]="";"";ROUND((368-SUM([.B$13:.$B27]))/60;1)) -> 
A27: 2024-06-04 | D27: of:=IF([.B27]<>"";([.$E$2]-SUM([.$B$3:.$B27])) & "/" & (ROUND(([.$E$2]-SUM([.$B$3:.$B27]))/60;1));"") ->  | E27: of:=IF(OR([.E26]="" ;[.E26]=0);"";IF([.E26]-60>0;[.E26]-60;0)) -> 309 | F27: of:=IF([.B27]<>"";[.E27]-([.$E$2]-SUM([.$B$3:.$B27]));"") ->  | G27: of:=IF([.B27]="";"";ROUND((368-SUM([.B$13:.$B28]))/60;1)) -> 
A28: 2024-06-05 | D28: of:=IF([.B28]<>"";([.$E$2]-SUM([.$B$3:.$B28])) & "/" & (ROUND(([.$E$2]-SUM([.$B$3:.$B28]))/60;1));"") ->  | E28: of:=IF(OR([.E27]="" ;[.E27]=0);"";IF([.E27]-60>0;[.E27]-60;0)) -> 249 | F28: of:=IF([.B28]<>"";[.E28]-([.$E$2]-SUM([.$B$3:.$B28]));"") ->  | G28: of:=IF([.B28]="";"";ROUND((368-SUM([.B$13:.$B29]))/60;1)) -> 
A29: 2024-06-06 | D29: of:=IF([.B29]<>"";([.$E$2]-SUM([.$B$3:.$B29])) & "/" & (ROUND(([.$E$2]-SUM([.$B$3:.$B29]))/60;1));"") ->  | E29: of:=IF(OR([.E28]="" ;[.E28]=0);"";IF([.E28]-60>0;[.E28]-60;0)) -> 189 | F29: of:=IF([.B29]<>"";[.E29]-([.$E$2]-SUM([.$B$3:.$B29]));"") ->  | G29: of:=IF([.B29]="";"";ROUND((368-SUM([.B$13:.$B30]))/60;1)) -> 
A30: 2024-06-07 | D30: of:=IF([.B30]<>"";([.$E$2]-SUM([.$B$3:.$B30])) & "/" & (ROUND(([.$E$2]-SUM([.$B$3:.$B30]))/60;1));"") ->  | E30: of:=IF(OR([.E29]="" ;[.E29]=0);"";IF([.E29]-60>0;[.E29]-60;0)) -> 129 | F30: of:=IF([.B30]<>"";[.E30]-([.$E$2]-SUM([.$B$3:.$B30]));"") ->  | G30: of:=IF([.B30]="";"";ROUND((368-SUM([.B$13:.$B31]))/60;1)) -> 
A31: 2024-06-08 | D31: of:=IF([.B31]<>"";([.$E$2]-SUM([.$B$3:.$B31])) & "/" & (ROUND(([.$E$2]-SUM([.$B$3:.$B31]))/60;1));"") ->  | E31: of:=IF(OR([.E30]="" ;[.E30]=0);"";IF([.E30]-60>0;[.E30]-60;0)) -> 69 | F31: of:=IF([.B31]<>"";[.E31]-([.$E$2]-SUM([.$B$3:.$B31]));"") ->  | G31: of:=IF([.B31]="";"";ROUND((368-SUM([.B$13:.$B32]))/60;1)) -> 
A32: 2024-06-09 | D32: of:=IF([.B32]<>"";([.$E$2]-SUM([.$B$3:.$B32])) & "/" & (ROUND(([.$E$2]-SUM([.$B$3:.$B32]))/60;1));"") ->  | E32: of:=IF(OR([.E31]="" ;[.E31]=0);"";IF([.E31]-60>0;[.E31]-60;0)) -> 9 | F32: of:=IF([.B32]<>"";[.E32]-([.$E$2]-SUM([.$B$3:.$B32]));"") ->  | G32: of:=IF([.B32]="";"";ROUND((368-SUM([.B$13:.$B33]))/60;1)) -> 
A33: 2024-06-10 | D33: of:=IF([.B33]<>"";([.$E$2]-SUM([.$B$3:.$B33])) & "/" & (ROUND(([.$E$2]-SUM([.$B$3:.$B33]))/60;1));"") ->  | E33: of:=IF(OR([.E32]="" ;[.E32]=0);"";IF([.E32]-60>0;[.E32]-60;0)) -> 0 | F33: of:=IF([.B33]<>"";[.E33]-([.$E$2]-SUM([.$B$3:.$B33]));"") ->  | G33: of:=IF([.B33]="";"";ROUND((368-SUM([.B$13:.$B34]))/60;1)) -> 
A34: 2024-06-11 | D34: of:=IF([.B34]<>"";([.$E$2]-SUM([.$B$3:.$B34])) & "/" & (ROUND(([.$E$2]-SUM([.$B$3:.$B34]))/60;1));"") ->  | E34: of:=IF(OR([.E33]="" ;[.E33]=0);"";IF([.E33]-60>0;[.E33]-60;0)) ->  | F34: of:=IF([.B34]<>"";[.E34]-([.$E$2]-SUM([.$B$3:.$B34]));"") ->  | G34: of:=IF([.B34]="";"";ROUND((368-SUM([.B$13:.$B35]))/60;1)) -> 
A35: 2024-06-12 | D35: of:=IF([.B35]<>"";([.$E$2]-SUM([.$B$3:.$B35])) & "/" & (ROUND(([.$E$2]-SUM([.$B$3:.$B35]))/60;1));"") ->  | E35: of:=IF(OR([.E34]="" ;[.E34]=0);"";IF([.E34]-60>0;[.E34]-60;0)) ->  | F35: of:=IF([.B35]<>"";[.E35]-([.$E$2]-SUM([.$B$3:.$B35]));"") ->  | G35: of:=IF([.B35]="";"";ROUND((368-SUM([.B$13:.$B36]))/60;1)) -> 
A36: 2024-06-13 | D36: of:=IF([.B36]<>"";([.$E$2]-SUM([.$B$3:.$B36])) & "/" & (ROUND(([.$E$2]-SUM([.$B$3:.$B36]))/60;1));"") ->  | E36: of:=IF(OR([.E35]="" ;[.E35]=0);"";IF([.E35]-60>0;[.E35]-60;0)) ->  | F36: of:=IF([.B36]<>"";[.E36]-([.$E$2]-SUM([.$B$3:.$B36]));"") ->  | G36: of:=IF([.B36]="";"";ROUND((368-SUM([.B$13:.$B37]))/60;1)) -> 
A37: 2024-06-14 | D37: of:=IF([.B37]<>"";([.$E$2]-SUM([.$B$3:.$B37])) & "/" & (ROUND(([.$E$2]-SUM([.$B$3:.$B37]))/60;1));"") ->  | E37: of:=IF(OR([.E36]="" ;[.E36]=0);"";IF([.E36]-60>0;[.E36]-60;0)) ->  | F37: of:=IF([.B37]<>"";[.E37]-([.$E$2]-SUM([.$B$3:.$B37]));"") ->  | G37: of:=IF([.B37]="";"";ROUND((368-SUM([.B$13:.$B38]))/60;1)) -> 
A38: 2024-06-15 | D38: of:=IF([.B38]<>"";([.$E$2]-SUM([.$B$3:.$B38])) & "/" & (ROUND(([.$E$2]-SUM([.$B$3:.$B38]))/60;1));"") ->  | E38: of:=IF(OR([.E37]="" ;[.E37]=0);"";IF([.E37]-60>0;[.E37]-60;0)) ->  | F38: of:=IF([.B38]<>"";[.E38]-([.$E$2]-SUM([.$B$3:.$B38]));"") ->  | G38: of:=IF([.B38]="";"";ROUND((368-SUM([.B$13:.$B39]))/60;1)) -> 
A39: 2024-06-16 | D39: of:=IF([.B39]<>"";([.$E$2]-SUM([.$B$3:.$B39])) & "/" & (ROUND(([.$E$2]-SUM([.$B$3:.$B39]))/60;1));"") ->  | E39: of:=IF(OR([.E38]="" ;[.E38]=0);"";IF([.E38]-60>0;[.E38]-60;0)) ->  | F39: of:=IF([.B39]<>"";[.E39]-([.$E$2]-SUM([.$B$3:.$B39]));"") ->  | G39: of:=IF([.B39]="";"";ROUND((368-SUM([.B$13:.$B40]))/60;1)) -> 
A40: 2024-06-17 | D40: of:=IF([.B40]<>"";([.$E$2]-SUM([.$B$3:.$B40])) & "/" & (ROUND(([.$E$2]-SUM([.$B$3:.$B40]))/60;1));"") ->  | E40: of:=IF(OR([.E39]="" ;[.E39]=0);"";IF([.E39]-60>0;[.E39]-60;0)) ->  | F40: of:=IF([.B40]<>"";[.E40]-([.$E$2]-SUM([.$B$3:.$B40]));"") ->  | G40: of:=IF([.B40]="";"";ROUND((368-SUM([.B$13:.$B41]))/60;1)) -> 
A41: 2024-06-18 | D41: of:=IF([.B41]<>"";([.$E$2]-SUM([.$B$3:.$B41])) & "/" & (ROUND(([.$E$2]-SUM([.$B$3:.$B41]))/60;1));"") ->  | E41: of:=IF(OR([.E40]="" ;[.E40]=0);"";IF([.E40]-60>0;[.E40]-60;0)) ->  | F41: of:=IF([.B41]<>"";[.E41]-([.$E$2]-SUM([.$B$3:.$B41]));"") ->  | G41: of:=IF([.B41]="";"";ROUND((368-SUM([.B$13:.$B42]))/60;1)) -> 
A42: 2024-06-19 | D42: of:=IF([.B42]<>"";([.$E$2]-SUM([.$B$3:.$B42])) & "/" & (ROUND(([.$E$2]-SUM([.$B$3:.$B42]))/60;1));"") ->  | E42: of:=IF(OR([.E41]="" ;[.E41]=0);"";IF([.E41]-60>0;[.E41]-60;0)) ->  | F42: of:=IF([.B42]<>"";[.E42]-([.$E$2]-SUM([.$B$3:.$B42]));"") ->  | G42: of:=IF([.B42]="";"";ROUND((368-SUM([.B$13:.$B43]))/60;1)) -> 
A43: 2024-06-20 | D43: of:=IF([.B43]<>"";([.$E$2]-SUM([.$B$3:.$B43])) & "/" & (ROUND(([.$E$2]-SUM([.$B$3:.$B43]))/60;1));"") ->  | E43: of:=IF(OR([.E42]="" ;[.E42]=0);"";IF([.E42]-60>0;[.E42]-60;0)) ->  | F43: of:=IF([.B43]<>"";[.E43]-([.$E$2]-SUM([.$B$3:.$B43]));"") ->  | G43: of:=IF([.B43]="";"";ROUND((368-SUM([.B$13:.$B44]))/60;1)) -> 
A44: 2024-06-21 | D44: of:=IF([.B44]<>"";([.$E$2]-SUM([.$B$3:.$B44])) & "/" & (ROUND(([.$E$2]-SUM([.$B$3:.$B44]))/60;1));"") ->  | E44: of:=IF(OR([.E43]="" ;[.E43]=0);"";IF([.E43]-60>0;[.E43]-60;0)) ->  | F44: of:=IF([.B44]<>"";[.E44]-([.$E$2]-SUM([.$B$3:.$B44]));"") ->  | G44: of:=IF([.B44]="";"";ROUND((368-SUM([.B$13:.$B45]))/60;1)) -> 
A46: TOTALE | B46: of:=SUM([.B3:.B44]) -> 38